Name,Cost,Type,Effect
Absorb,{W}{U}{U},Instant,Counter target spell. You gain 3 life.
Acclaimed Contender,{2}{W},Creature — Human Knight,"When Acclaimed Contender enters the battlefield, if you control another Knight, look at the top five cards of your library. You may reveal a Knight, Aura, Equipment, or legendary artifact card from among them and put it into your hand. Put the rest on the bottom of your library in a random order."
Act of Treason,{2}{R},Sorcery,Gain control of target creature until end of turn. Untap that creature. It gains haste until end of turn. (It can attack and {T} this turn.)
Aerial Assault,{2}{W},Sorcery,Destroy target tapped creature. You gain 1 life for each creature you control with flying.
Aeromunculus,{1}{G}{U},Creature — Homunculus Mutant,"Flying {2}{G}{U}: Adapt 1. (If this creature has no +1/+1 counters on it, put a +1/+1 counter on it.)"
Aether Gust,{1}{U},Instant,Choose target spell or permanent that's red or green. Its owner puts it on the top or bottom of their library.
Affectionate Indrik,{5}{G},Creature — Beast,"When Affectionate Indrik enters the battlefield, you may have it fight target creature you don't control. (Each deals damage equal to its power to the other.)"
Agent of Treachery,{5}{U}{U},Creature — Human Rogue,"When Agent of Treachery enters the battlefield, gain control of target permanent. At the beginning of your end step, if you control three or more permanents you don't own, draw three cards."
Aggressive Mammoth,{3}{G}{G}{G},Creature — Elephant,Trample (This creature can deal excess combat damage to the player or planeswalker it's attacking.) Other creatures you control have trample.
Agonizing Syphon,{3}{B},Sorcery,Agonizing Syphon deals 3 damage to any target and you gain 3 life.
Ahn-Crop Invader,{2}{R},Creature — Zombie Minotaur Warrior,"As long as it's your turn, Ahn-Crop Invader has first strike. {1}, Sacrifice another creature: Ahn-Crop Invader gets +2/+0 until end of turn."
Aid the Fallen,{1}{B},Sorcery,Choose one or both — • Return target creature card from your graveyard to your hand. • Return target planeswalker card from your graveyard to your hand.
Air Elemental,{3}{U}{U},Creature — Elemental,Flying
Ajani's Pridemate,{1}{W},Creature — Cat Soldier,"Whenever you gain life, put a +1/+1 counter on Ajani's Pridemate."
"Ajani, Inspiring Leader",{4}{W}{W},Legendary Planeswalker — Ajani,[+2]: You gain 2 life. Put two +1/+1 counters on up to one target creature. [−3]: Exile target creature. Its controller gains 2 life. [−10]: Creatures you control gain flying and double strike until end of turn.
"Ajani, Strength of the Pride",{2}{W}{W},Legendary Planeswalker — Ajani,"[+1]: You gain life equal to the number of creatures you control plus the number of planeswalkers you control. [−2]: Create a 2/2 white Cat Soldier creature token named Ajani's Pridemate with ""Whenever you gain life, put a +1/+1 counter on Ajani's Pridemate."" [0]: If you have at least 15 life more than your starting life total, exile Ajani, Strength of the Pride and each artifact and creature your opponents control."
"Ajani, the Greathearted",{2}{G}{W},Legendary Planeswalker — Ajani,Creatures you control have vigilance. [+1]: You gain 3 life. [−2]: Put a +1/+1 counter on each creature you control and a loyalty counter on each other planeswalker you control.
"Alela, Artful Provocateur",{1}{W}{U}{B},Legendary Creature — Faerie Warlock,"Flying, deathtouch, lifelink Other creatures you control with flying get +1/+0. Whenever you cast an artifact or enchantment spell, create a 1/1 blue Faerie creature token with flying."
All That Glitters,{1}{W},Enchantment — Aura,Enchant creature Enchanted creature gets +1/+1 for each artifact and/or enchantment you control.
Alter Fate,{1}{B},Sorcery — Adventure,Return target creature card from your graveyard to your hand. (Then exile this card. You may cast the creature later from exile.)
Amplifire,{2}{R}{R},Creature — Elemental,"At the beginning of your upkeep, reveal cards from the top of your library until you reveal a creature card. Until your next turn, Amplifire's base power becomes twice that card's power and its base toughness becomes twice that card's toughness. Put the revealed cards on the bottom of your library in a random order."
Ancestral Blade,{1}{W},Artifact — Equipment,"When Ancestral Blade enters the battlefield, create a 1/1 white Soldier creature token, then attach Ancestral Blade to it. Equipped creature gets +1/+1. Equip {1} ({1}: Attach to target creature you control. Equip only as a sorcery.)"
Angel of Grace,{3}{W}{W},Creature — Angel,"Flash Flying When Angel of Grace enters the battlefield, until end of turn, damage that would reduce your life total to less than 1 reduces it to 1 instead. {4}{W}{W}, Exile Angel of Grace from your graveyard: Your life total becomes 10."
Angel of Vitality,{2}{W},Creature — Angel,"Flying If you would gain life, you gain that much life plus 1 instead. Angel of Vitality gets +2/+2 as long as you have 25 or more life."
Angelic Exaltation,{3}{W},Enchantment,"Whenever a creature you control attacks alone, it gets +X/+X until end of turn, where X is the number of creatures you control."
Angelic Gift,{1}{W},Enchantment — Aura,"Enchant creature When Angelic Gift enters the battlefield, draw a card. Enchanted creature has flying."
Angelic Guardian,{4}{W}{W},Creature — Angel,"Flying (This creature can't be blocked except by creatures with flying or reach.) Whenever one or more creatures you control attack, they gain indestructible until end of turn. (Damage and effects that say ""destroy"" don't destroy them.)"
Angrath's Rampage,{B}{R},Sorcery,Choose one — • Target player sacrifices an artifact. • Target player sacrifices a creature. • Target player sacrifices a planeswalker.
"Angrath, Captain of Chaos",{2}{B/R}{B/R},Legendary Planeswalker — Angrath,"Creatures you control have menace. [−2]: Amass 2. (Put two +1/+1 counters on an Army you control. If you don't control one, create a 0/0 black Zombie Army creature token first.)"
Animating Faerie,{2}{U},Creature — Faerie,Flying
Anticipate,{1}{U},Instant,Look at the top three cards of your library. Put one of them into your hand and the rest on the bottom of your library in any order.
Anvilwrought Raptor,{4},Artifact Creature — Bird,Flying First strike (This creature deals combat damage before creatures without first strike.)
Apostle of Purifying Light,{1}{W},Creature — Human Cleric,"Protection from black (This creature can't be blocked, targeted, dealt damage, enchanted, or equipped by anything black.) {2}: Exile target card from a graveyard."
Applied Biomancy,{G}{U},Instant,Choose one or both — • Target creature gets +1/+1 until end of turn. • Return target creature to its owner's hand.
Arboreal Grazer,{G},Creature — Beast,"Reach When Arboreal Grazer enters the battlefield, you may put a land card from your hand onto the battlefield tapped."
Arboretum Elemental,{7}{G}{G},Creature — Elemental,Convoke (Your creatures can help cast this spell. Each creature you tap while casting this spell pays for {1} or one mana of the creature's color.) Hexproof (This creature can't be the target of spells or abilities your opponents control.)
Arcane Signet,{2},Artifact,{T}: Add one mana of any color in your commander's color identity.
Arcanist's Owl,{W/U}{W/U}{W/U}{W/U},Artifact Creature — Bird,"Flying When Arcanist's Owl enters the battlefield, look at the top four cards of your library. You may reveal an artifact or enchantment card from among them and put it into your hand. Put the rest on the bottom of your library in a random order."
Archon of Absolution,{3}{W},Creature — Archon,"Flying Protection from white (This creature can't be blocked, targeted, dealt damage, enchanted, or equipped by anything white.) Creatures can't attack you or a planeswalker you control unless their controller pays {1} for each of those creatures."
Archway Angel,{5}{W},Creature — Angel,"Flying When Archway Angel enters the battlefield, you gain 2 life for each Gate you control."
Arclight Phoenix,{3}{R},Creature — Phoenix,"Flying, haste At the beginning of combat on your turn, if you've cast three or more instant and sorcery spells this turn, return Arclight Phoenix from your graveyard to the battlefield."
Ardenvale Paladin,{3}{W},Creature — Human Knight,"Adamant — If at least three white mana was spent to cast this spell, Ardenvale Paladin enters the battlefield with a +1/+1 counter on it."
Ardenvale Tactician,{1}{W}{W},Creature — Human Knight,Flying
Arlinn's Wolf,{2}{G},Creature — Wolf,Arlinn's Wolf can't be blocked by creatures with power 2 or less.
"Arlinn, Voice of the Pack",{4}{G}{G},Legendary Planeswalker — Arlinn,Each creature you control that's a Wolf or a Werewolf enters the battlefield with an additional +1/+1 counter on it. [−2]: Create a 2/2 green Wolf creature token.
Arrester's Admonition,{2}{U},Instant,"Return target creature to its owner's hand. Addendum — If you cast this spell during your main phase, draw a card."
Arrester's Zeal,{W},Instant,"Target creature gets +2/+2 until end of turn. Addendum — If you cast this spell during your main phase, that creature gains flying until end of turn."
Artful Takedown,{2}{U}{B},Instant,Choose one or both — • Tap target creature. • Target creature gets -2/-4 until end of turn.
Ashiok's Skulker,{4}{U},Creature — Nightmare,{3}{U}: Ashiok's Skulker can't be blocked this turn.
"Ashiok, Dream Render",{1}{U/B}{U/B},Legendary Planeswalker — Ashiok,Spells and abilities your opponents control can't cause their controller to search their library. [−1]: Target player puts the top four cards of their library into their graveyard. Then exile each opponent's graveyard.
Assassin's Trophy,{B}{G},Instant,"Destroy target permanent an opponent controls. Its controller may search their library for a basic land card, put it onto the battlefield, then shuffle their library."
Assemble,{4}{G}{W},Instant,Create three 2/2 green and white Elf Knight creature tokens with vigilance.
Assure,{G/W}{G/W},Instant,Put a +1/+1 counter on target creature. That creature gains indestructible until end of turn.
"Atemsis, All-Seeing",{3}{U}{U}{U},Legendary Creature — Sphinx,"Flying {2}{U}, {T}: Draw two cards, then discard a card. Whenever Atemsis, All-Seeing deals damage to an opponent, you may reveal your hand. If cards with at least six different converted mana costs are revealed this way, that player loses the game."
Attendant of Vraska,{1}{B}{G},Creature — Zombie Soldier,"When Attendant of Vraska dies, if you control a Vraska planeswalker, you gain life equal to Attendant of Vraska's power."
Audacious Thief,{2}{B},Creature — Human Rogue,"Whenever Audacious Thief attacks, you draw a card and you lose 1 life."
Augur of Bolas,{1}{U},Creature — Merfolk Wizard,"When Augur of Bolas enters the battlefield, look at the top three cards of your library. You may reveal an instant or sorcery card from among them and put it into your hand. Put the rest on the bottom of your library in any order."
"Aurelia, Exemplar of Justice",{2}{R}{W},Legendary Creature — Angel,"Flying Mentor (Whenever this creature attacks, put a +1/+1 counter on target attacking creature with lesser power.) At the beginning of combat on your turn, choose up to one target creature you control. Until end of turn, that creature gets +2/+0, gains trample if it's red, and gains vigilance if it's white."
Aven Eternal,{2}{U},Creature — Zombie Bird Warrior,"Flying When Aven Eternal enters the battlefield, amass 1. (Put a +1/+1 counter on an Army you control. If you don't control one, create a 0/0 black Zombie Army creature token first.)"
Awaken the Erstwhile,{3}{B}{B},Sorcery,"Each player discards all the cards in their hand, then creates that many 2/2 black Zombie creature tokens."
Awakening of Vitu-Ghazi,{3}{G}{G},Instant,Put nine +1/+1 counters on target land you control. It becomes a legendary 0/0 Elemental creature with haste named Vitu-Ghazi. It's still a land.
Axebane Beast,{3}{G},Creature — Beast,nan
"Ayara, First of Locthwain",{B}{B}{B},Legendary Creature — Elf Noble,"Whenever Ayara, First of Locthwain or another black creature enters the battlefield under your control, each opponent loses 1 life and you gain 1 life. {T}, Sacrifice another black creature: Draw a card."
Azorius Guildgate,nan,Land — Gate,Azorius Guildgate enters the battlefield tapped. {T}: Add {W} or {U}.
Azorius Knight-Arbiter,{3}{W}{U},Creature — Human Knight,Vigilance Azorius Knight-Arbiter can't be blocked.
Azorius Locket,{3},Artifact,"{T}: Add {W} or {U}. {W/U}{W/U}{W/U}{W/U}, {T}, Sacrifice Azorius Locket: Draw two cards."
Azorius Skyguard,{4}{W}{U},Creature — Human Knight,"Flying, first strike Creatures your opponents control get -1/-0."
Bag of Holding,{1},Artifact,"Whenever you discard a card, exile that card from your graveyard. {2}, {T}: Draw a card, then discard a card. {4}, {T}, Sacrifice Bag of Holding: Return all cards exiled with Bag of Holding to their owner's hand."
Bake into a Pie,{2}{B}{B},Instant,"Destroy target creature. Create a Food token. (It's an artifact with ""{2}, {T}, Sacrifice this artifact: You gain 3 life."")"
Band Together,{2}{G},Instant,Up to two target creatures you control each deal damage equal to their power to another target creature.
Banehound,{B},Creature — Nightmare Hound,"Lifelink, haste"
Banish into Fable,{4}{W}{U},Instant,"When you cast this spell from your hand, copy it if you control an artifact, then copy it if you control an enchantment. You may choose new targets for the copies. Return target nonland permanent to its owner's hand. You create a 2/2 white Knight creature token with vigilance."
Bankrupt in Blood,{1}{B},Sorcery,"As an additional cost to cast this spell, sacrifice two creatures. Draw three cards."
Barge In,{R},Instant,Target attacking creature gets +2/+2 until end of turn. Each attacking non-Human creature gains trample until end of turn.
Barging Sergeant,{4}{R},Creature — Minotaur Soldier,"Haste Mentor (Whenever this creature attacks, put a +1/+1 counter on target attacking creature with lesser power.)"
Barkhide Troll,{G}{G},Creature — Troll,"Barkhide Troll enters the battlefield with a +1/+1 counter on it. {1}, Remove a +1/+1 counter from Barkhide Troll: Barkhide Troll gains hexproof until end of turn. (It can't be the target of spells or abilities your opponents control.)"
Barony Vampire,{2}{B},Creature — Vampire,nan
Barrier of Bones,{B},Creature — Skeleton Wall,"Defender When Barrier of Bones enters the battlefield, surveil 1. (Look at the top card of your library. You may put that card into your graveyard.)"
Barrow Witches,{4}{B},Creature — Human Warlock,"When Barrow Witches enters the battlefield, return target Knight card from your graveyard to your hand."
Bartered Cow,{3}{W},Creature — Ox,"When Bartered Cow dies or when you discard it, create a Food token. (It's an artifact with ""{2}, {T}, Sacrifice this artifact: You gain 3 life."")"
Bartizan Bats,{3}{B},Creature — Bat,Flying (This creature can't be blocked except by creatures with flying or reach.)
Basilica Bell-Haunt,{W}{W}{B}{B},Creature — Spirit,"When Basilica Bell-Haunt enters the battlefield, each opponent discards a card and you gain 3 life."
Bastion Enforcer,{2}{W},Creature — Dwarf Soldier,nan
Battalion Foot Soldier,{2}{W},Creature — Human Soldier,"When Battalion Foot Soldier enters the battlefield, you may search your library for any number of cards named Battalion Foot Soldier, reveal them, put them into your hand, then shuffle your library."
Battle Display,{R},Sorcery — Adventure,Destroy target artifact. (Then exile this card. You may cast the creature later from exile.)
Battlefield Promotion,{1}{W},Instant,Put a +1/+1 counter on target creature. That creature gains first strike until end of turn. You gain 2 life.
Beacon Bolt,{1}{U}{R},Sorcery,Beacon Bolt deals damage to target creature equal to the total number of instant and sorcery cards you own in exile and in your graveyard. Jump-start (You may cast this card from your graveyard by discarding a card in addition to paying its other costs. Then exile this card.)
Beamsplitter Mage,{U}{R},Creature — Vedalken Wizard,"Whenever you cast an instant or sorcery spell that targets only Beamsplitter Mage, if you control one or more other creatures that spell could target, choose one of those creatures. Copy that spell. The copy targets the chosen creature."
Beanstalk Giant,{6}{G},Creature — Giant,Beanstalk Giant's power and toughness are each equal to the number of lands you control.
Beast Whisperer,{2}{G}{G},Creature — Elf Druid,"Whenever you cast a creature spell, draw a card."
Bedazzle,{4}{B}{R},Instant,Destroy target nonbasic land. Bedazzle deals 2 damage to target opponent or planeswalker.
Bedeck,{B/R}{B/R},Instant,Target creature gets +3/-3 until end of turn.
Bedevil,{B}{B}{R},Instant,"Destroy target artifact, creature, or planeswalker."
Befuddle,{2}{U},Instant,Target creature gets -4/-0 until end of turn. Draw a card.
Belle of the Brawl,{2}{B},Creature — Human Knight,"Menace (This creature can't be blocked except by two or more creatures.) Whenever Belle of the Brawl attacks, other Knights you control get +1/+0 until end of turn."
Beloved Princess,{W},Creature — Human Noble,Lifelink Beloved Princess can't be blocked by creatures with power 3 or greater.
Benthic Biomancer,{U},Creature — Merfolk Wizard Mutant,"{1}{U}: Adapt 1. (If this creature has no +1/+1 counters on it, put a +1/+1 counter on it.) Whenever one or more +1/+1 counters are put on Benthic Biomancer, draw a card, then discard a card."
Bioessence Hydra,{3}{G}{U},Creature — Hydra Mutant,"Trample Bioessence Hydra enters the battlefield with a +1/+1 counter on it for each loyalty counter on planeswalkers you control. Whenever one or more loyalty counters are put on planeswalkers you control, put that many +1/+1 counters on Bioessence Hydra."
Biogenic Ooze,{3}{G}{G},Creature — Ooze,"When Biogenic Ooze enters the battlefield, create a 2/2 green Ooze creature token. At the beginning of your end step, put a +1/+1 counter on each Ooze you control. {1}{G}{G}{G}: Create a 2/2 green Ooze creature token."
Biogenic Upgrade,{4}{G}{G},Sorcery,"Distribute three +1/+1 counters among one, two, or three target creatures, then double the number of +1/+1 counters on each of those creatures."
Biomancer's Familiar,{G}{U},Creature — Mutant,"Activated abilities of creatures you control cost {2} less to activate. This effect can't reduce the amount of mana an ability costs to activate to less than one mana. {T}: The next time target creature adapts this turn, it adapts as though it had no +1/+1 counters on it."
Bishop of Wings,{W}{W},Creature — Human Cleric,"Whenever an Angel enters the battlefield under your control, you gain 4 life. Whenever an Angel you control dies, create a 1/1 white Spirit creature token with flying."
Blacklance Paragon,{1}{B},Creature — Human Knight,"Flash When Blacklance Paragon enters the battlefield, target Knight gains deathtouch and lifelink until end of turn."
Blade Instructor,{2}{W},Creature — Human Soldier,"Mentor (Whenever this creature attacks, put a +1/+1 counter on target attacking creature with lesser power.)"
Blade Juggler,{4}{B},Creature — Human Rogue,"Spectacle {2}{B} (You may cast this spell for its spectacle cost rather than its mana cost if an opponent lost life this turn.) When Blade Juggler enters the battlefield, it deals 1 damage to you and you draw a card."
Bladebrand,{1}{B},Instant,Target creature gains deathtouch until end of turn. (Any amount of damage it deals to a creature is enough to destroy it.) Draw a card.
Blast Zone,nan,Land,"Blast Zone enters the battlefield with a charge counter on it. {T}: Add {C}. {X}{X}, {T}: Put X charge counters on Blast Zone. {3}, {T}, Sacrifice Blast Zone: Destroy each nonland permanent with converted mana cost equal to the number of charge counters on Blast Zone."
Bleeding Edge,{1}{B}{B},Sorcery,"Up to one target creature gets -2/-2 until end of turn. Amass 2. (Put two +1/+1 counters on an Army you control. If you don't control one, create a 0/0 black Zombie Army creature token first.)"
Blightbeetle,{1}{B},Creature — Insect,"Protection from green (This creature can't be blocked, targeted, dealt damage, enchanted, or equipped by anything green.) Creatures your opponents control can't have +1/+1 counters put on them."
Blindblast,{2}{R},Instant,Blindblast deals 1 damage to target creature. That creature can't block this turn. Draw a card.
Blood Burglar,{1}{B},Creature — Vampire Rogue,"As long as it's your turn, Blood Burglar has lifelink. (Damage dealt by this creature also causes you to gain that much life.)"
Blood Crypt,nan,Land — Swamp Mountain,"({T}: Add {B} or {R}.) As Blood Crypt enters the battlefield, you may pay 2 life. If you don't, it enters the battlefield tapped."
Blood Operative,{1}{B}{B},Creature — Vampire Assassin,"Lifelink When Blood Operative enters the battlefield, you may exile target card from a graveyard. Whenever you surveil, if Blood Operative is in your graveyard, you may pay 3 life. If you do, return Blood Operative to your hand."
Blood for Bones,{3}{B},Sorcery,"As an additional cost to cast this spell, sacrifice a creature. Return a creature card from your graveyard to the battlefield, then return another creature card from your graveyard to your hand."
Bloodfell Caves,nan,Land,"Bloodfell Caves enters the battlefield tapped. When Bloodfell Caves enters the battlefield, you gain 1 life. {T}: Add {B} or {R}."
Bloodhaze Wolverine,{1}{R},Creature — Wolverine,"Whenever you draw your second card each turn, Bloodhaze Wolverine gets +1/+1 and gains first strike until end of turn."
Bloodmist Infiltrator,{2}{B},Creature — Vampire,"Whenever Bloodmist Infiltrator attacks, you may sacrifice another creature. If you do, Bloodmist Infiltrator can't be blocked this turn."
Bloodsoaked Altar,{4}{B}{B},Artifact,"{T}, Pay 2 life, Discard a card, Sacrifice a creature: Create a 5/5 black Demon creature token with flying. Activate this ability only any time you could cast a sorcery."
Bloodthirsty Aerialist,{1}{B}{B},Creature — Vampire Rogue,"Flying Whenever you gain life, put a +1/+1 counter on Bloodthirsty Aerialist."
Bloom Hulk,{3}{G},Creature — Plant Elemental,"When Bloom Hulk enters the battlefield, proliferate. (Choose any number of permanents and/or players, then give each another counter of each kind already there.)"
Blossoming Sands,nan,Land,"Blossoming Sands enters the battlefield tapped. When Blossoming Sands enters the battlefield, you gain 1 life. {T}: Add {G} or {W}."
Blow Your House Down,{2}{R},Sorcery,Up to three target creatures can't block this turn. Destroy any of them that are Walls.
Bog Naughty,{3}{B}{B},Creature — Faerie,"Flying {2}{B}, Sacrifice a Food: Target creature gets -3/-3 until end of turn."
Bogstomper,{4}{B}{B},Creature — Beast,nan
Bolas's Citadel,{3}{B}{B}{B},Legendary Artifact,"You may look at the top card of your library any time. You may play the top card of your library. If you cast a spell this way, pay life equal to its converted mana cost rather than pay its mana cost. {T}, Sacrifice ten nonland permanents: Each opponent loses 10 life."
Bolrac-Clan Crusher,{3}{R}{G},Creature — Ogre Warrior,"{T}, Remove a +1/+1 counter from a creature you control: Bolrac-Clan Crusher deals 2 damage to any target."
Bolt Bend,{3}{R},Instant,This spell costs {3} less to cast if you control a creature with power 4 or greater. Change the target of target spell or ability with a single target.
Bond of Discipline,{4}{W},Sorcery,Tap all creatures your opponents control. Creatures you control gain lifelink until end of turn.
Bond of Flourishing,{1}{G},Sorcery,Look at the top three cards of your library. You may reveal a permanent card from among them and put it into your hand. Put the rest on the bottom of your library in any order. You gain 3 life.
Bond of Insight,{3}{U},Sorcery,Each player puts the top four cards of their library into their graveyard. Return up to two instant and/or sorcery cards from your graveyard to your hand. Exile Bond of Insight.
Bond of Passion,{4}{R}{R},Sorcery,Gain control of target creature until end of turn. Untap that creature. It gains haste until end of turn. Bond of Passion deals 2 damage to any other target.
Bond of Revival,{4}{B},Sorcery,Return target creature card from your graveyard to the battlefield. It gains haste until your next turn.
Bone Splinters,{B},Sorcery,"As an additional cost to cast this spell, sacrifice a creature. Destroy target creature."
Bone to Ash,{2}{U}{U},Instant,Counter target creature spell. Draw a card.
Boneclad Necromancer,{3}{B}{B},Creature — Human Wizard,"When Boneclad Necromancer enters the battlefield, you may exile target creature card from a graveyard. If you do, create a 2/2 black Zombie creature token."
Bonecrusher Giant,{2}{R},Creature — Giant,"Whenever Bonecrusher Giant becomes the target of a spell, Bonecrusher Giant deals 2 damage to that spell's controller."
Book Devourer,{5}{R},Creature — Beast,"Trample Whenever Book Devourer deals combat damage to a player, you may discard all the cards in your hand. If you do, draw that many cards."
Boreal Elemental,{4}{U},Creature — Elemental,Flying Spells your opponents cast that target Boreal Elemental cost {2} more to cast.
Boros Challenger,{R}{W},Creature — Human Soldier,"Mentor (Whenever this creature attacks, put a +1/+1 counter on target attacking creature with lesser power.) {2}{R}{W}: Boros Challenger gets +1/+1 until end of turn."
Boros Guildgate,nan,Land — Gate,Boros Guildgate enters the battlefield tapped. {T}: Add {R} or {W}.
Boros Locket,{3},Artifact,"{T}: Add {R} or {W}. {R/W}{R/W}{R/W}{R/W}, {T}, Sacrifice Boros Locket: Draw two cards."
