Name,Cost,Type,Effect
Silent Submersible,{U}{U},Artifact — Vehicle,"Whenever Silent Submersible deals combat damage to a player or planeswalker, draw a card. Crew 2 (Tap any number of creatures you control with total power 2 or more: This Vehicle becomes an artifact creature until end of turn.)"
Silhana Wayfinder,{1}{G},Creature — Elf Scout,"When Silhana Wayfinder enters the battlefield, look at the top four cards of your library. You may reveal a creature or land card from among them and put it on top of your library. Put the rest on the bottom of your library in a random order."
Silverback Shaman,{3}{G}{G},Creature — Ape Shaman,"Trample (This creature can deal excess combat damage to the player or planeswalker it's attacking.) When Silverback Shaman dies, draw a card."
Silverflame Ritual,{3}{W},Sorcery,"Put a +1/+1 counter on each creature you control. Adamant — If at least three white mana was spent to cast this spell, creatures you control gain vigilance until end of turn."
Silverflame Squire,{1}{W},Creature — Human Soldier,nan
Silverwing Squadron,{5}{W},Creature — Human Knight,"Flying, vigilance Silverwing Squadron's power and toughness are each equal to the number of creatures you control. Whenever Silverwing Squadron attacks, create a number of 2/2 white Knight creature tokens with vigilance equal to the number of opponents you have."
Simic Ascendancy,{G}{U},Enchantment,"{1}{G}{U}: Put a +1/+1 counter on target creature you control. Whenever one or more +1/+1 counters are put on a creature you control, put that many growth counters on Simic Ascendancy. At the beginning of your upkeep, if Simic Ascendancy has twenty or more growth counters on it, you win the game."
Simic Guildgate,nan,Land — Gate,Simic Guildgate enters the battlefield tapped. {T}: Add {G} or {U}.
Simic Locket,{3},Artifact,"{T}: Add {G} or {U}. {G/U}{G/U}{G/U}{G/U}, {T}, Sacrifice Simic Locket: Draw two cards."
Single Combat,{3}{W}{W},Sorcery,"Each player chooses a creature or planeswalker they control, then sacrifices the rest. Players can't cast creature or planeswalker spells until the end of your next turn."
Sinister Sabotage,{1}{U}{U},Instant,Counter target spell. Surveil 1. (Look at the top card of your library. You may put that card into your graveyard.)
Skarrgan Hellkite,{3}{R}{R},Creature — Dragon,Riot (This creature enters the battlefield with your choice of a +1/+1 counter or haste.) Flying {3}{R}: Skarrgan Hellkite deals 2 damage divided as you choose among one or two targets. Activate this ability only if Skarrgan Hellkite has a +1/+1 counter on it.
Skatewing Spy,{3}{U},Creature — Vedalken Rogue Mutant,"{5}{U}: Adapt 2. (If this creature has no +1/+1 counters on it, put two +1/+1 counters on it.) Each creature you control with a +1/+1 counter on it has flying."
Skeleton Archer,{3}{B},Creature — Skeleton Archer,"When Skeleton Archer enters the battlefield, it deals 1 damage to any target."
Skewer the Critics,{2}{R},Sorcery,Spectacle {R} (You may cast this spell for its spectacle cost rather than its mana cost if an opponent lost life this turn.) Skewer the Critics deals 3 damage to any target.
Skitter Eel,{3}{U},Creature — Fish Crab,"{2}{U}: Adapt 2. (If this creature has no +1/+1 counters on it, put two +1/+1 counters on it.)"
Skullknocker Ogre,{3}{R},Creature — Ogre,"Whenever Skullknocker Ogre deals damage to an opponent, that player discards a card at random. If the player does, they draw a card."
Sky Tether,{W},Enchantment — Aura,Enchant creature Enchanted creature has defender and loses flying.
Sky Theater Strix,{1}{U},Creature — Bird,"Flying Whenever you cast a noncreature spell, Sky Theater Strix gets +1/+0 until end of turn."
Skyknight Legionnaire,{1}{R}{W},Creature — Human Knight,"Flying, haste"
Skyknight Vanguard,{R}{W},Creature — Human Knight,"Flying Whenever Skyknight Vanguard attacks, create a 1/1 white Soldier creature token that's tapped and attacking."
Skyline Scout,{1}{W},Creature — Human Scout,"Whenever Skyline Scout attacks, you may pay {1}{W}. If you do, it gains flying until end of turn."
Slaying Fire,{2}{R},Instant,"Slaying Fire deals 3 damage to any target. Adamant — If at least three red mana was spent to cast this spell, it deals 4 damage instead."
Sleep Paralysis,{3}{U},Enchantment — Aura,"Enchant creature When Sleep Paralysis enters the battlefield, tap enchanted creature. Enchanted creature doesn't untap during its controller's untap step."
Slimebind,{1}{U},Enchantment — Aura,Flash Enchant creature Enchanted creature gets -4/-0.
Smelt-Ward Ignus,{1}{R},Creature — Elemental,"{2}{R}, Sacrifice Smelt-Ward Ignus: Gain control of target creature with power 3 or less until end of turn. Untap that creature. It gains haste until end of turn. Activate this ability only any time you could cast a sorcery."
Smelt-Ward Minotaur,{2}{R},Creature — Minotaur Warrior,"Whenever you cast an instant or sorcery spell, target creature an opponent controls can't block this turn."
Smitten Swordmaster,{1}{B},Creature — Human Knight,Lifelink
Smothering Tithe,{3}{W},Enchantment,"Whenever an opponent draws a card, that player may pay {2}. If the player doesn't, you create a Treasure token. (It's an artifact with ""{T}, Sacrifice this artifact: Add one mana of any color."")"
Snapping Drake,{3}{U},Creature — Drake,Flying (This creature can't be blocked except by creatures with flying or reach.)
Snarespinner,{1}{G},Creature — Spider,"Reach Whenever Snarespinner blocks a creature with flying, Snarespinner gets +2/+0 until end of turn."
So Tiny,{U},Enchantment — Aura,Flash Enchant creature Enchanted creature gets -2/-0. It gets -6/-0 instead as long as its controller has seven or more cards in their graveyard.
Solar Blaze,{2}{R}{W},Sorcery,Each creature deals damage to itself equal to its power.
Sonic Assault,{1}{U}{R},Instant,Tap target creature. Sonic Assault deals 2 damage to that creature's controller. Jump-start (You may cast this card from your graveyard by discarding a card in addition to paying its other costs. Then exile this card.)
Sorcerer of the Fang,{1}{B},Creature — Human Wizard,"{5}{B}, {T}: Sorcerer of the Fang deals 2 damage to target opponent or planeswalker."
Sorcerer's Broom,{2},Artifact Creature — Spirit,"Whenever you sacrifice another permanent, you may pay {3}. If you do, create a token that's a copy of Sorcerer's Broom."
Sorcerous Spyglass,{2},Artifact,"As Sorcerous Spyglass enters the battlefield, look at an opponent's hand, then choose any card name. Activated abilities of sources with the chosen name can't be activated unless they're mana abilities."
Sorin's Guide,{3}{B}{B},Creature — Vampire,"When Sorin's Guide enters the battlefield, you may search your library and/or graveyard for a card named Sorin, Vampire Lord, reveal it, and put it into your hand. If you search your library this way, shuffle it."
Sorin's Thirst,{B}{B},Instant,Sorin's Thirst deals 2 damage to target creature and you gain 2 life.
"Sorin, Imperious Bloodlord",{2}{B},Legendary Planeswalker — Sorin,"[+1]: Target creature you control gains deathtouch and lifelink until end of turn. If it's a Vampire, put a +1/+1 counter on it. [+1]: You may sacrifice a Vampire. When you do, Sorin, Imperious Bloodlord deals 3 damage to any target and you gain 3 life. [−3]: You may put a Vampire creature card from your hand onto the battlefield."
"Sorin, Vampire Lord",{4}{B}{B},Legendary Planeswalker — Sorin,"[+1]: Up to one target creature gets +2/+0 until end of turn. [−2]: Sorin, Vampire Lord deals 4 damage to any target. You gain 4 life. [−8]: Until end of turn, each Vampire you control gains ""{T}: Gain control of target creature."""
"Sorin, Vengeful Bloodlord",{2}{W}{B},Legendary Planeswalker — Sorin,"As long as it's your turn, creatures and planeswalkers you control have lifelink. [+2]: Sorin, Vengeful Bloodlord deals 1 damage to target player or planeswalker. −X: Return target creature card with converted mana cost X from your graveyard to the battlefield. That creature is a Vampire in addition to its other types."
Soul Diviner,{U}{B},Creature — Zombie Wizard,"{T}, Remove a counter from an artifact, creature, land, or planeswalker you control: Draw a card."
Soul Salvage,{2}{B},Sorcery,Return up to two target creature cards from your graveyard to your hand.
Soulmender,{W},Creature — Human Cleric,{T}: You gain 1 life.
Spark Double,{3}{U},Creature — Illusion,"You may have Spark Double enter the battlefield as a copy of a creature or planeswalker you control, except it enters with an additional +1/+1 counter on it if it's a creature, it enters with an additional loyalty counter on it if it's a planeswalker, and it isn't legendary if that permanent is legendary."
Spark Harvest,{B},Sorcery,"As an additional cost to cast this spell, sacrifice a creature or pay {3}{B}. Destroy target creature or planeswalker."
Spark Reaper,{2}{B},Creature — Zombie,"{3}, Sacrifice a creature or planeswalker: You gain 1 life and draw a card."
Spawn of Mayhem,{2}{B}{B},Creature — Demon,"Spectacle {1}{B}{B} (You may cast this spell for its spectacle cost rather than its mana cost if an opponent lost life this turn.) Flying, trample At the beginning of your upkeep, Spawn of Mayhem deals 1 damage to each player. Then if you have 10 or less life, put a +1/+1 counter on Spawn of Mayhem."
Spear Spewer,{R},Creature — Goblin Warrior,Defender {T}: Spear Spewer deals 1 damage to each player.
Specter's Shriek,{B},Sorcery,"Target opponent reveals their hand. You may choose a nonland card from it. If you do, that player exiles that card. If a nonblack card is exiled this way, exile a card from your hand."
Spectral Sailor,{U},Creature — Spirit Pirate,Flash (You may cast this spell any time you could cast an instant.) Flying {3}{U}: Draw a card.
Spellgorger Weird,{2}{R},Creature — Weird,"Whenever you cast a noncreature spell, put a +1/+1 counter on Spellgorger Weird."
Spellkeeper Weird,{2}{U},Creature — Weird,"{2}, {T}, Sacrifice Spellkeeper Weird: Return target instant or sorcery card from your graveyard to your hand."
Sphinx of Foresight,{2}{U}{U},Creature — Sphinx,"You may reveal this card from your opening hand. If you do, scry 3 at the beginning of your first upkeep. Flying At the beginning of your upkeep, scry 1."
Sphinx of New Prahv,{W}{W}{U}{U},Creature — Sphinx,"Flying, vigilance Spells your opponents cast that target Sphinx of New Prahv cost {2} more to cast."
Sphinx of the Guildpact,{7},Artifact Creature — Sphinx,Sphinx of the Guildpact is all colors. Flying Hexproof from monocolored (This creature can't be the target of monocolored spells or abilities your opponents control.)
Sphinx's Insight,{2}{W}{U},Instant,"Draw two cards. Addendum — If you cast this spell during your main phase, you gain 2 life."
Spikewheel Acrobat,{3}{R},Creature — Human Rogue,Spectacle {2}{R} (You may cast this spell for its spectacle cost rather than its mana cost if an opponent lost life this turn.)
Spinal Centipede,{2}{B},Creature — Insect,"When Spinal Centipede dies, put a +1/+1 counter on target creature you control."
Spinning Wheel,{3},Artifact,"{T}: Add one mana of any color. {5}, {T}: Tap target creature."
Spire Mangler,{2}{B},Creature — Insect,"Flash Flying When Spire Mangler enters the battlefield, target creature with flying you control gets +2/+0 until end of turn."
Spirit of the Spires,{3}{W},Creature — Spirit,Flying Other creatures you control with flying get +0/+1.
Sporecap Spider,{2}{G},Creature — Spider,Reach (This creature can block creatures with flying.)
Sprouting Renewal,{2}{G},Sorcery,Convoke (Your creatures can help cast this spell. Each creature you tap while casting this spell pays for {1} or one mana of that creature's color.) Choose one — • Create a 2/2 green and white Elf Knight creature token with vigilance. • Destroy target artifact or enchantment.
Squad Captain,{4}{W},Creature — Human Soldier,Vigilance (Attacking doesn't cause this creature to tap.) Squad Captain enters the battlefield with a +1/+1 counter on it for each other creature you control.
Starfield Mystic,{1}{W},Creature — Human Cleric,"Enchantment spells you cast cost {1} less to cast. Whenever an enchantment you control is put into a graveyard from the battlefield, put a +1/+1 counter on Starfield Mystic."
Statue,{2}{B}{G},Instant,"Destroy target artifact, creature, or enchantment."
Status,{B/G},Instant,Target creature gets +1/+1 and gains deathtouch until end of turn.
Steadfast Sentry,{2}{W},Creature — Human Soldier,"Vigilance (Attacking doesn't cause this creature to tap.) When Steadfast Sentry dies, put a +1/+1 counter on target creature you control."
Steady Aim,{1}{G},Instant,Untap target creature. It gets +1/+4 and gains reach until end of turn.
Stealth Mission,{2}{U},Sorcery,Put two +1/+1 counters on target creature you control. That creature can't be blocked this turn.
Steam Vents,nan,Land — Island Mountain,"({T}: Add {U} or {R}.) As Steam Vents enters the battlefield, you may pay 2 life. If you don't, it enters the battlefield tapped."
Steel Overseer,{2},Artifact Creature — Construct,{T}: Put a +1/+1 counter on each artifact creature you control.
Steelbane Hydra,{X}{G}{G},Creature — Turtle Hydra,"Steelbane Hydra enters the battlefield with X +1/+1 counters on it. {2}{G}, Remove a +1/+1 counter from Steelbane Hydra: Destroy target artifact or enchantment."
Steelclaw Lance,{B}{R},Artifact — Equipment,Equipped creature gets +2/+2. Equip Knight {1} ({1}: Attach to target Knight creature you control. Equip only as a sorcery.) Equip {3} ({3}: Attach to target creature you control. Equip only as a sorcery.)
Steelgaze Griffin,{4}{U},Creature — Griffin,"Flying Whenever you draw your second card each turn, Steelgaze Griffin gets +2/+0 until end of turn."
Steeple Creeper,{2}{G},Creature — Frog Snake,{3}{U}: Steeple Creeper gains flying until end of turn.
Stolen by the Fae,{X}{U}{U},Sorcery,Return target creature with converted mana cost X to its owner's hand. You create X 1/1 blue Faerie creature tokens with flying.
Stomp,{1}{R},Instant — Adventure,Damage can't be prevented this turn. Stomp deals 2 damage to any target.
Stomping Ground,nan,Land — Mountain Forest,"({T}: Add {R} or {G}.) As Stomping Ground enters the battlefield, you may pay 2 life. If you don't, it enters the battlefield tapped."
Stone Golem,{5},Artifact Creature — Golem,nan
Stonecoil Serpent,{X},Artifact Creature — Snake,"Reach, trample, protection from multicolored Stonecoil Serpent enters the battlefield with X +1/+1 counters on it."
Stony Strength,{G},Instant,Put a +1/+1 counter on target creature you control. Untap that creature.
Storm Strike,{R},Instant,Target creature gets +1/+0 and gains first strike until end of turn. Scry 1.
Storm the Citadel,{4}{G},Sorcery,"Until end of turn, creatures you control get +2/+2 and gain ""Whenever this creature deals combat damage to a player or planeswalker, destroy target artifact or enchantment defending player controls."""
Stormfist Crusader,{B}{R},Creature — Human Knight,"Menace At the beginning of your upkeep, each player draws a card and loses 1 life."
"Storrev, Devkarin Lich",{1}{B}{B}{G},Legendary Creature — Zombie Elf Wizard,"Trample Whenever Storrev, Devkarin Lich deals combat damage to a player or planeswalker, return to your hand target creature or planeswalker card in your graveyard that wasn't put there this combat."
Street Riot,{4}{R},Enchantment,"As long as it's your turn, creatures you control get +1/+0 and have trample."
Sumala Woodshaper,{2}{G}{W},Creature — Elf Druid,"When Sumala Woodshaper enters the battlefield, look at the top four cards of your library. You may reveal a creature or enchantment card from among them and put it into your hand. Put the rest on the bottom of your library in a random order."
Summary Judgment,{1}{W},Instant,"Summary Judgment deals 3 damage to target tapped creature. Addendum — If you cast this spell during your main phase, it deals 5 damage instead."
Sunblade Angel,{5}{W},Creature — Angel,"Flying, first strike, vigilance, lifelink"
Sunder Shaman,{R}{R}{G}{G},Creature — Giant Shaman,"Sunder Shaman can't be blocked by more than one creature. Whenever Sunder Shaman deals combat damage to a player, destroy target artifact or enchantment that player controls."
Sundering Stroke,{6}{R},Sorcery,"Sundering Stroke deals 7 damage divided as you choose among one, two, or three targets. If at least seven red mana was spent to cast this spell, instead Sundering Stroke deals 7 damage to each of those permanents and/or players."
Sunhome Stalwart,{1}{W},Creature — Human Soldier,"First strike Mentor (Whenever this creature attacks, put a +1/+1 counter on target attacking creature with lesser power.)"
Sure Strike,{1}{R},Instant,Target creature gets +3/+0 and gains first strike until end of turn.
Swamp,nan,Basic Land — Swamp,({T}: Add {B}.)
Swarm Guildmage,{B}{G},Creature — Elf Shaman,"{4}{B}, {T}: Creatures you control get +1/+0 and gain menace until end of turn. (They can't be blocked except by two or more creatures.) {1}{G}, {T}: You gain 2 life."
Swathcutter Giant,{4}{R}{W},Creature — Giant Soldier,"Vigilance Whenever Swathcutter Giant attacks, it deals 1 damage to each creature defending player controls."
Swift End,{1}{B}{B},Instant — Adventure,Destroy target creature or planeswalker. You lose 2 life. (Then exile this card. You may cast the creature later from exile.)
Swiftblade Vindicator,{R}{W},Creature — Human Soldier,"Double strike, vigilance, trample"
Swiftwater Cliffs,nan,Land,"Swiftwater Cliffs enters the battlefield tapped. When Swiftwater Cliffs enters the battlefield, you gain 1 life. {T}: Add {U} or {R}."
Swirling Torrent,{5}{U},Sorcery,Choose one or both — • Put target creature on top of its owner's library. • Return target creature to its owner's hand.
Sworn Companions,{2}{W},Sorcery,Create two 1/1 white Soldier creature tokens with lifelink.
Sylvan Brushstrider,{2}{G},Creature — Beast,"When Sylvan Brushstrider enters the battlefield, you gain 2 life."
Syndicate Guildmage,{W}{B},Creature — Human Cleric,"{1}{W}, {T}: Tap target creature with power 4 or greater. {4}{B}, {T}: Syndicate Guildmage deals 2 damage to target opponent or planeswalker."
Syndicate Messenger,{3}{W},Creature — Bird,"Flying Afterlife 1 (When this creature dies, create a 1/1 white and black Spirit creature token with flying.)"
"Syr Alin, the Lion's Claw",{3}{W}{W},Legendary Creature — Human Knight,"First strike Whenever Syr Alin, the Lion's Claw attacks, other creatures you control get +1/+1 until end of turn."
"Syr Carah, the Bold",{3}{R}{R},Legendary Creature — Human Knight,"When Syr Carah, the Bold or an instant or sorcery spell you control deals damage to a player, exile the top card of your library. You may play that card this turn. {T}: Syr Carah deals 1 damage to any target."
"Syr Elenora, the Discerning",{3}{U}{U},Legendary Creature — Human Knight,"Syr Elenora, the Discerning's power is equal to the number of cards in your hand. When Syr Elenora enters the battlefield, draw a card. Spells your opponents cast that target Syr Elenora cost {2} more to cast."
"Syr Faren, the Hengehammer",{G}{G},Legendary Creature — Human Knight,"Whenever Syr Faren, the Hengehammer attacks, another target attacking creature gets +X/+X until end of turn, where X is Syr Faren's power."
"Syr Gwyn, Hero of Ashvale",{3}{R}{W}{B},Legendary Creature — Human Knight,"Vigilance, menace Whenever an equipped creature you control attacks, you draw a card and you lose 1 life. Equipment you control have equip Knight {0}."
"Syr Konrad, the Grim",{3}{B}{B},Legendary Creature — Human Knight,"Whenever another creature dies, or a creature card is put into a graveyard from anywhere other than the battlefield, or a creature card leaves your graveyard, Syr Konrad, the Grim deals 1 damage to each opponent. {1}{B}: Each player puts the top card of their library into their graveyard."
"Tajic, Legion's Edge",{1}{R}{W},Legendary Creature — Human Soldier,"Haste Mentor (Whenever this creature attacks, put a +1/+1 counter on target attacking creature with lesser power.) Prevent all noncombat damage that would be dealt to other creatures you control. {R}{W}: Tajic, Legion's Edge gains first strike until end of turn."
Take Heart,{W},Instant,Target creature gets +2/+2 until end of turn. You gain 1 life for each attacking creature you control.
Take Vengeance,{1}{W},Sorcery,Destroy target tapped creature.
Tale's End,{1}{U},Instant,"Counter target activated ability, triggered ability, or legendary spell."
Tall as a Beanstalk,{3}{G},Enchantment — Aura,"Enchant creature Enchanted creature gets +3/+3, has reach, and is a Giant in addition to its other types."
Tamiyo's Epiphany,{3}{U},Sorcery,"Scry 4, then draw two cards."
"Tamiyo, Collector of Tales",{2}{G}{U},Legendary Planeswalker — Tamiyo,"Spells and abilities your opponents control can't cause you to discard cards or sacrifice permanents. [+1]: Choose a nonland card name, then reveal the top four cards of your library. Put all cards with the chosen name from among them into your hand and the rest into your graveyard. [−3]: Return target card from your graveyard to your hand."
Taste of Death,{4}{B}{B},Sorcery,"Each player sacrifices three creatures. You create three Food tokens. (They're artifacts with ""{2}, {T}, Sacrifice this artifact: You gain 3 life."")"
Tectonic Rift,{3}{R},Sorcery,Destroy target land. Creatures without flying can't block this turn.
Teferi's Time Twist,{1}{U},Instant,"Exile target permanent you control. Return that card to the battlefield under its owner's control at the beginning of the next end step. If it enters the battlefield as a creature, it enters with an additional +1/+1 counter on it."
"Teferi, Time Raveler",{1}{W}{U},Legendary Planeswalker — Teferi,"Each opponent can cast spells only any time they could cast a sorcery. [+1]: Until your next turn, you may cast sorcery spells as though they had flash. [−3]: Return up to one target artifact, creature, or enchantment to its owner's hand. Draw a card."
Temple Garden,nan,Land — Forest Plains,"({T}: Add {G} or {W}.) As Temple Garden enters the battlefield, you may pay 2 life. If you don't, it enters the battlefield tapped."
Temple of Epiphany,nan,Land,"Temple of Epiphany enters the battlefield tapped. When Temple of Epiphany enters the battlefield, scry 1. {T}: Add {U} or {R}."
Temple of Malady,nan,Land,"Temple of Malady enters the battlefield tapped. When Temple of Malady enters the battlefield, scry 1. {T}: Add {B} or {G}."
Temple of Mystery,nan,Land,"Temple of Mystery enters the battlefield tapped. When Temple of Mystery enters the battlefield, scry 1. {T}: Add {G} or {U}."
Temple of Silence,nan,Land,"Temple of Silence enters the battlefield tapped. When Temple of Silence enters the battlefield, scry 1. {T}: Add {W} or {B}."
Temple of Triumph,nan,Land,"Temple of Triumph enters the battlefield tapped. When Temple of Triumph enters the battlefield, scry 1. {T}: Add {R} or {W}."
Tempting Witch,{2}{B},Creature — Human Warlock,"When Tempting Witch enters the battlefield, create a Food token. (It's an artifact with ""{2}, {T}, Sacrifice this artifact: You gain 3 life."") {2}, {T}, Sacrifice a Food: Target player loses 3 life."
Tenth District Guard,{1}{W},Creature — Human Soldier,"When Tenth District Guard enters the battlefield, target creature gets +0/+1 until end of turn."
Tenth District Legionnaire,{R}{W},Creature — Human Soldier,"Haste Whenever you cast a spell that targets Tenth District Legionnaire, put a +1/+1 counter on Tenth District Legionnaire, then scry 1."
Tenth District Veteran,{2}{W},Creature — Human Soldier,"Vigilance Whenever Tenth District Veteran attacks, untap another target creature you control."
Territorial Boar,{1}{G},Creature — Boar,"Whenever a creature with power 4 or greater enters the battlefield under your control, Territorial Boar gets +1/+1 and gains vigilance until end of turn."
Teyo's Lightshield,{2}{W},Creature — Illusion,"When Teyo's Lightshield enters the battlefield, put a +1/+1 counter on target creature you control."
"Teyo, the Shieldmage",{2}{W},Legendary Planeswalker — Teyo,You have hexproof. (You can't be the target of spells or abilities your opponents control.) [−2]: Create a 0/3 white Wall creature token with defender.
Teysa Karlov,{2}{W}{B},Legendary Creature — Human Advisor,"If a creature dying causes a triggered ability of a permanent you control to trigger, that ability triggers an additional time. Creature tokens you control have vigilance and lifelink."
"Tezzeret, Master of the Bridge",{4}{U}{B},Legendary Planeswalker — Tezzeret,"Creature and planeswalker spells you cast have affinity for artifacts. (They cost {1} less to cast for each artifact you control.) [+2]: Tezzeret, Master of the Bridge deals X damage to each opponent, where X is the number of artifacts you control. You gain X life. [−3]: Return target artifact card from your graveyard to your hand. [−8]: Exile the top ten cards of your library. Put all artifact cards from among them onto the battlefield."
The Cauldron of Eternity,{10}{B}{B},Legendary Artifact,"This spell costs {2} less to cast for each creature card in your graveyard. Whenever a creature you control dies, put it on the bottom of its owner's library. {2}{B}, {T}, Pay 2 life: Return target creature card from your graveyard to the battlefield. Activate this ability only any time you could cast a sorcery."
The Circle of Loyalty,{4}{W}{W},Legendary Artifact,"This spell costs {1} less to cast for each Knight you control. Creatures you control get +1/+1. Whenever you cast a legendary spell, create a 2/2 white Knight creature token with vigilance. {3}{W}, {T}: Create a 2/2 white Knight creature token with vigilance."
