Name,Cost,Type,Effect
Darkblade Agent,{1}{U}{B},Creature — Human Assassin,"As long as you've surveilled this turn, Darkblade Agent has deathtouch and ""Whenever this creature deals combat damage to a player, you draw a card."""
Davriel's Shadowfugue,{3}{B},Sorcery,Target player discards two cards and loses 2 life.
"Davriel, Rogue Shadowmage",{2}{B},Legendary Planeswalker — Davriel,"At the beginning of each opponent's upkeep, if that player has one or fewer cards in hand, Davriel, Rogue Shadowmage deals 2 damage to them. [−1]: Target player discards a card."
Dawn of Hope,{1}{W},Enchantment,"Whenever you gain life, you may pay {2}. If you do, draw a card. {3}{W}: Create a 1/1 white Soldier creature token with lifelink."
Dawning Angel,{4}{W},Creature — Angel,"Flying When Dawning Angel enters the battlefield, you gain 4 life."
Daybreak Chaplain,{1}{W},Creature — Human Cleric,Lifelink (Damage dealt by this creature also causes you to gain that much life.)
Dazzling Lights,{U},Instant,"Target creature gets -3/-0 until end of turn. Surveil 2. (Look at the top two cards of your library, then put any number of them into your graveyard and the rest on the top of your library in any order.)"
Dead Revels,{3}{B},Sorcery,Spectacle {1}{B} (You may cast this spell for its spectacle cost rather than its mana cost if an opponent lost life this turn.) Return up to two target creature cards from your graveyard to your hand.
Dead Weight,{B},Enchantment — Aura,Enchant creature Enchanted creature gets -2/-2.
Deadly Visit,{3}{B}{B},Sorcery,"Destroy target creature. Surveil 2. (Look at the top two cards of your library, then put any number of them into your graveyard and the rest on top of your library in any order.)"
Deafening Clarion,{1}{R}{W},Sorcery,Choose one or both — • Deafening Clarion deals 3 damage to each creature. • Creatures you control gain lifelink until end of turn.
Deafening Silence,{W},Enchantment,Each player can't cast more than one noncreature spell each turn.
Deathless Knight,{B/G}{B/G}{B/G}{B/G},Creature — Skeleton Knight,"Haste When you gain life for the first time each turn, return Deathless Knight from your graveyard to your hand."
Deathsprout,{1}{B}{B}{G},Instant,"Destroy target creature. Search your library for a basic land card, put it onto the battlefield tapped, then shuffle your library."
Debtors' Transport,{5}{B},Creature — Thrull,"Afterlife 2 (When this creature dies, create two 1/1 white and black Spirit creature tokens with flying.)"
Deface,{R},Sorcery,Choose one — • Destroy target artifact. • Destroy target creature with defender.
Defiant Strike,{W},Instant,Target creature gets +1/+0 until end of turn. Draw a card.
Deliver Unto Evil,{2}{B},Sorcery,"Choose up to four target cards in your graveyard. If you control a Bolas planeswalker, return those cards to your hand. Otherwise, an opponent chooses two of them. Leave the chosen cards in your graveyard and put the rest into your hand. Exile Deliver Unto Evil."
Demolish,{3}{R},Sorcery,Destroy target artifact or land.
Demotion,{W},Enchantment — Aura,"Enchant creature Enchanted creature can't block, and its activated abilities can't be activated."
Deploy,{2}{W}{U},Instant,"Create two 1/1 colorless Thopter artifact creature tokens with flying, then you gain 1 life for each creature you control."
Depose,{1}{W/U},Instant,Tap target creature. Draw a card.
Deputy of Detention,{1}{W}{U},Creature — Vedalken Wizard,"When Deputy of Detention enters the battlefield, exile target nonland permanent an opponent controls and all other nonland permanents that player controls with the same name as that permanent until Deputy of Detention leaves the battlefield."
Despark,{W}{B},Instant,Exile target permanent with converted mana cost 4 or greater.
Desperate Lunge,{1}{W},Instant,Target creature gets +2/+2 and gains flying until end of turn. You gain 2 life.
Destructive Digger,{2}{R},Creature — Goblin,"{3}, {T}, Sacrifice an artifact or land: Draw a card."
Devious Cover-Up,{2}{U}{U},Instant,"Counter target spell. If that spell is countered this way, exile it instead of putting it into its owner's graveyard. You may shuffle up to four target cards from your graveyard into your library."
Devkarin Dissident,{1}{G},Creature — Elf Warrior,{4}{G}: Devkarin Dissident gets +2/+2 until end of turn.
Devouring Hellion,{2}{R},Creature — Hellion,"As Devouring Hellion enters the battlefield, you may sacrifice any number of creatures and/or planeswalkers. If you do, it enters with twice that many +1/+1 counters on it."
Devout Decree,{1}{W},Sorcery,Exile target creature or planeswalker that's black or red. Scry 1. (Look at the top card of your library. You may put that card on the bottom of your library.)
Diamond Knight,{3},Artifact Creature — Knight,"Vigilance (Attacking doesn't cause this creature to tap.) As Diamond Knight enters the battlefield, choose a color. Whenever you cast a spell of the chosen color, put a +1/+1 counter on Diamond Knight."
Didn't Say Please,{1}{U}{U},Instant,Counter target spell. Its controller puts the top three cards of their library into their graveyard.
Dimir Guildgate,nan,Land — Gate,Dimir Guildgate enters the battlefield tapped. {T}: Add {U} or {B}.
Dimir Informant,{2}{U},Creature — Human Rogue,"When Dimir Informant enters the battlefield, surveil 2. (Look at the top two cards of your library, then put any number of them into your graveyard and the rest on the top of your library in any order.)"
Dimir Locket,{3},Artifact,"{T}: Add {U} or {B}. {U/B}{U/B}{U/B}{U/B}, {T}, Sacrifice Dimir Locket: Draw two cards."
Dimir Spybug,{U}{B},Creature — Insect,"Flying Menace (This creature can't be blocked except by two or more creatures.) Whenever you surveil, put a +1/+1 counter on Dimir Spybug."
Direct Current,{1}{R}{R},Sorcery,Direct Current deals 2 damage to any target. Jump-start (You may cast this card from your graveyard by discarding a card in addition to paying its other costs. Then exile this card.)
Discovery,{1}{U/B},Sorcery,"Surveil 2, then draw a card. (To surveil 2, look at the top two cards of your library, then put any number of them into your graveyard and the rest on top of your library in any order.)"
Disdainful Stroke,{1}{U},Instant,Counter target spell with converted mana cost 4 or greater.
Disenchant,{1}{W},Instant,Destroy target artifact or enchantment.
Disentomb,{B},Sorcery,Return target creature card from your graveyard to your hand.
Disfigure,{B},Instant,Target creature gets -2/-2 until end of turn.
Disinformation Campaign,{1}{U}{B},Enchantment,"When Disinformation Campaign enters the battlefield, you draw a card and each opponent discards a card. Whenever you surveil, return Disinformation Campaign to its owner's hand."
Dismal Backwater,nan,Land,"Dismal Backwater enters the battlefield tapped. When Dismal Backwater enters the battlefield, you gain 1 life. {T}: Add {U} or {B}."
Dispersal,{3}{U}{B},Instant,"Each opponent returns a nonland permanent they control with the highest converted mana cost among permanents they control to its owner's hand, then discards a card."
District Guide,{2}{G},Creature — Elf Scout,"When District Guide enters the battlefield, you may search your library for a basic land card or Gate card, reveal it, put it into your hand, then shuffle your library."
Divine Arrow,{1}{W},Instant,Divine Arrow deals 4 damage to target attacking or blocking creature.
Divine Visitation,{3}{W}{W},Enchantment,"If one or more creature tokens would be created under your control, that many 4/4 white Angel creature tokens with flying and vigilance are created instead."
Diviner's Lockbox,{4},Artifact,"{1}, {T}: Choose a card name, then reveal the top card of your library. If that card has the chosen name, sacrifice Diviner's Lockbox and draw three cards. Activate this ability only any time you could cast a sorcery."
Dizzying Swoop,{1}{W},Instant — Adventure,Tap up to two target creatures. (Then exile this card. You may cast the creature later from exile.)
Domri's Ambush,{R}{G},Sorcery,Put a +1/+1 counter on target creature you control. Then that creature deals damage equal to its power to target creature or planeswalker you don't control.
Domri's Nodorog,{3}{R}{G},Creature — Beast,"Trample When Domri's Nodorog enters the battlefield, you may search your library and/or graveyard for a card named Domri, City Smasher, reveal it, and put it into your hand. If you search your library this way, shuffle it."
"Domri, Anarch of Bolas",{1}{R}{G},Legendary Planeswalker — Domri,Creatures you control get +1/+0. [+1]: Add {R} or {G}. Creature spells you cast this turn can't be countered. [−2]: Target creature you control fights target creature you don't control.
"Domri, Chaos Bringer",{2}{R}{G},Legendary Planeswalker — Domri,"[+1]: Add {R} or {G}. If that mana is spent on a creature spell, it gains riot. (It enters the battlefield with your choice of a +1/+1 counter or haste.) [−3]: Look at the top four cards of your library. You may reveal up to two creature cards from among them and put them into your hand. Put the rest on the bottom of your library in a random order. [−8]: You get an emblem with ""At the beginning of each end step, create a 4/4 red and green Beast creature token with trample."""
"Domri, City Smasher",{4}{R}{G},Legendary Planeswalker — Domri,"[+2]: Creatures you control get +1/+1 and gain haste until end of turn. [−3]: Domri, City Smasher deals 3 damage to any target. [−8]: Put three +1/+1 counters on each creature you control. Those creatures gain trample until end of turn."
Doom Foretold,{2}{W}{B},Enchantment,"At the beginning of each player's upkeep, that player sacrifices a nonland, nontoken permanent. If that player can't, they discard a card, they lose 2 life, you draw a card, you gain 2 life, you create a 2/2 white Knight creature token with vigilance, then you sacrifice Doom Foretold."
Doom Whisperer,{3}{B}{B},Creature — Nightmare Demon,"Flying, trample Pay 2 life: Surveil 2. (Look at the top two cards of your library, then put any number of them into your graveyard and the rest on the top of your library in any order.)"
Douser of Lights,{4}{B},Creature — Horror,nan
Dovin's Acuity,{1}{W}{U},Enchantment,"When Dovin's Acuity enters the battlefield, you gain 2 life and draw a card. Whenever you cast an instant spell during your main phase, you may return Dovin's Acuity to its owner's hand."
Dovin's Automaton,{4},Artifact Creature — Homunculus,"As long as you control a Dovin planeswalker, Dovin's Automaton gets +2/+2 and has vigilance. (Attacking doesn't cause it to tap.)"
Dovin's Dismissal,{2}{W}{U},Instant,"Put up to one target tapped creature on top of its owner's library. You may search your library and/or graveyard for a card named Dovin, Architect of Law, reveal it, and put it into your hand. If you search your library this way, shuffle it."
Dovin's Veto,{W}{U},Instant,This spell can't be countered. Counter target noncreature spell.
"Dovin, Architect of Law",{4}{W}{U},Legendary Planeswalker — Dovin,[+1]: You gain 2 life and draw a card. [−1]: Tap target creature. It doesn't untap during its controller's next untap step. [−9]: Tap all permanents target opponent controls. That player skips their next untap step.
"Dovin, Grand Arbiter",{1}{W}{U},Legendary Planeswalker — Dovin,"[+1]: Until end of turn, whenever a creature you control deals combat damage to a player, put a loyalty counter on Dovin, Grand Arbiter. [−1]: Create a 1/1 colorless Thopter artifact creature token with flying. You gain 1 life. [−7]: Look at the top ten cards of your library. Put three of them into your hand and the rest on the bottom of your library in a random order."
"Dovin, Hand of Control",{2}{W/U},Legendary Planeswalker — Dovin,"Artifact, instant, and sorcery spells your opponents cast cost {1} more to cast. [−1]: Until your next turn, prevent all damage that would be dealt to and dealt by target permanent an opponent controls."
Dragon Mage,{5}{R}{R},Creature — Dragon Wizard,"Flying Whenever Dragon Mage deals combat damage to a player, each player discards their hand, then draws seven cards."
"Drakuseth, Maw of Flames",{4}{R}{R}{R},Legendary Creature — Dragon,"Flying Whenever Drakuseth, Maw of Flames attacks, it deals 4 damage to any target and 3 damage to each of up to two other targets."
Drawn from Dreams,{2}{U}{U},Sorcery,Look at the top seven cards of your library. Put two of them into your hand and the rest on the bottom of your library in a random order.
Dread Presence,{3}{B},Creature — Nightmare,"Whenever a Swamp enters the battlefield under your control, choose one — • You draw a card and you lose 1 life. • Dread Presence deals 2 damage to any target and you gain 2 life."
Dreadhorde Arcanist,{1}{R},Creature — Zombie Wizard,"Trample Whenever Dreadhorde Arcanist attacks, you may cast target instant or sorcery card with converted mana cost less than or equal to Dreadhorde Arcanist's power from your graveyard without paying its mana cost. If that card would be put into your graveyard this turn, exile it instead."
Dreadhorde Butcher,{B}{R},Creature — Zombie Warrior,"Haste Whenever Dreadhorde Butcher deals combat damage to a player or planeswalker, put a +1/+1 counter on Dreadhorde Butcher. When Dreadhorde Butcher dies, it deals damage equal to its power to any target."
Dreadhorde Invasion,{1}{B},Enchantment,"At the beginning of your upkeep, you lose 1 life and amass 1. (Put a +1/+1 counter on an Army you control. If you don't control one, create a 0/0 black Zombie Army creature token first.) Whenever a Zombie token you control with power 6 or greater attacks, it gains lifelink until end of turn."
Dreadhorde Twins,{3}{R},Creature — Zombie Jackal Warrior,"When Dreadhorde Twins enters the battlefield, amass 2. (Put two +1/+1 counters on an Army you control. If you don't control one, create a 0/0 black Zombie Army creature token first.) Zombie tokens you control have trample."
Dreadmalkin,{B},Creature — Zombie Cat,"Menace (This creature can't be blocked except by two or more creatures.) {2}{B}, Sacrifice another creature or planeswalker: Put two +1/+1 counters on Dreadmalkin."
Dream Eater,{4}{U}{U},Creature — Nightmare Sphinx,"Flash Flying When Dream Eater enters the battlefield, surveil 4. When you do, you may return target nonland permanent an opponent controls to its owner's hand. (To surveil 4, look at the top four cards of your library, then put any number of them into your graveyard and the rest on top of your library in any order.)"
Drill Bit,{2}{B},Sorcery,Spectacle {B} (You may cast this spell for its spectacle cost rather than its mana cost if an opponent lost life this turn.) Target player reveals their hand. You choose a nonland card from it. That player discards that card.
Drown in the Loch,{U}{B},Instant,Choose one — • Counter target spell with converted mana cost less than or equal to the number of cards in its controller's graveyard. • Destroy target creature with converted mana cost less than or equal to the number of cards in its controller's graveyard.
Drowned Secrets,{1}{U},Enchantment,"Whenever you cast a blue spell, target player puts the top two cards of their library into their graveyard."
Dungeon Geists,{2}{U}{U},Creature — Spirit,"Flying When Dungeon Geists enters the battlefield, tap target creature an opponent controls. That creature doesn't untap during its controller's untap step for as long as you control Dungeon Geists."
Duress,{B},Sorcery,"Target opponent reveals their hand. You choose a noncreature, nonland card from it. That player discards that card."
Duskmantle Operative,{1}{B},Creature — Human Rogue,Duskmantle Operative can't be blocked by creatures with power 4 or greater.
Dwarven Mine,nan,Land — Mountain,"({T}: Add {R}.) Dwarven Mine enters the battlefield tapped unless you control three or more other Mountains. When Dwarven Mine enters the battlefield untapped, create a 1/1 red Dwarf creature token."
Edgewall Innkeeper,{G},Creature — Human Peasant,"Whenever you cast a creature spell that has an Adventure, draw a card. (It doesn't need to have gone on the adventure first.)"
Electrodominance,{X}{R}{R},Instant,Electrodominance deals X damage to any target. You may cast a card with converted mana cost X or less from your hand without paying its mana cost.
Electrostatic Field,{1}{R},Creature — Wall,"Defender Whenever you cast an instant or sorcery spell, Electrostatic Field deals 1 damage to each opponent."
Elite Arrester,{W},Creature — Human Soldier,"{1}{U}, {T}: Tap target creature."
Elite Guardmage,{2}{W}{U},Creature — Human Wizard,"Flying When Elite Guardmage enters the battlefield, you gain 3 life and draw a card."
Elite Headhunter,{B/R}{B/R}{B/R}{B/R},Creature — Human Knight,"Menace (This creature can't be blocked except by two or more creatures.) {B/R}{B/R}{B/R}, Sacrifice another creature or an artifact: Elite Headhunter deals 2 damage to target creature or planeswalker."
Elvish Reclaimer,{G},Creature — Elf Warrior,"Elvish Reclaimer gets +2/+2 as long as there are three or more land cards in your graveyard. {2}, {T}, Sacrifice a land: Search your library for a land card, put it onto the battlefield tapped, then shuffle your library."
Ember Hauler,{R}{R},Creature — Goblin,"{1}, Sacrifice Ember Hauler: It deals 2 damage to any target."
Embercleave,{4}{R}{R},Legendary Artifact — Equipment,"Flash This spell costs {1} less to cast for each attacking creature you control. When Embercleave enters the battlefield, attach it to target creature you control. Equipped creature gets +1/+1 and has double strike and trample. Equip {3}"
Embereth Paladin,{3}{R},Creature — Human Knight,"Haste Adamant — If at least three red mana was spent to cast this spell, Embereth Paladin enters the battlefield with a +1/+1 counter on it."
Embereth Shieldbreaker,{1}{R},Creature — Human Knight,nan
Embereth Skyblazer,{3}{R},Creature — Human Knight,"As long as it's your turn, Embereth Skyblazer has flying. Whenever Embereth Skyblazer attacks, you may pay {2}{R}. If you do, creatures you control get +X/+0 until end of turn, where X is the number of opponents you have."
Embodiment of Agonies,{1}{B}{B},Creature — Demon,"Flying, deathtouch Embodiment of Agonies enters the battlefield with a +1/+1 counter on it for each different mana cost among nonland cards in your graveyard. (For example, {2}{B} and {1}{B}{B} are different mana costs.)"
Emergence Zone,nan,Land,"{T}: Add {C}. {1}, {T}, Sacrifice Emergence Zone: You may cast spells this turn as though they had flash."
Emergency Powers,{5}{W}{U},Instant,"Each player shuffles their hand and graveyard into their library, then draws seven cards. Exile Emergency Powers. Addendum — If you cast this spell during your main phase, you may put a permanent card with converted mana cost 7 or less from your hand onto the battlefield."
"Emmara, Soul of the Accord",{G}{W},Legendary Creature — Elf Cleric,"Whenever Emmara, Soul of the Accord becomes tapped, create a 1/1 white Soldier creature token with lifelink."
Empyrean Eagle,{1}{W}{U},Creature — Bird Spirit,Flying Other creatures you control with flying get +1/+1.
"Emry, Lurker of the Loch",{2}{U},Legendary Creature — Merfolk Wizard,"This spell costs {1} less to cast for each artifact you control. When Emry, Lurker of the Loch enters the battlefield, put the top four cards of your library into your graveyard. {T}: Choose target artifact card in your graveyard. You may cast that card this turn. (You still pay its costs. Timing rules still apply.)"
Enchanted Carriage,{5},Artifact — Vehicle,"When Enchanted Carriage enters the battlefield, create two 1/1 white Mouse creature tokens. Crew 2 (Tap any number of creatures you control with total power 2 or more: This Vehicle becomes an artifact creature until end of turn.)"
End-Raze Forerunners,{5}{G}{G}{G},Creature — Boar,"Vigilance, trample, haste When End-Raze Forerunners enters the battlefield, other creatures you control get +2/+2 and gain vigilance and trample until end of turn."
Enforcer Griffin,{4}{W},Creature — Griffin,Flying
Engulfing Eruption,{2}{R}{R},Sorcery,Engulfing Eruption deals 5 damage to target creature.
Enhanced Surveillance,{1}{U},Enchantment,You may look at an additional two cards each time you surveil. Exile Enhanced Surveillance: Shuffle your graveyard into your library.
Enraged Ceratok,{2}{G}{G},Creature — Rhino,Enraged Ceratok can't be blocked by creatures with power 2 or less.
Enter the God-Eternals,{2}{U}{U}{B},Sorcery,"Enter the God-Eternals deals 4 damage to target creature and you gain life equal to the damage dealt this way. Target player puts the top four cards of their library into their graveyard. Amass 4. (Put four +1/+1 counters on an Army you control. If you don't control one, create a 0/0 black Zombie Army creature token first.)"
Epic Downfall,{1}{B},Sorcery,Exile target creature with converted mana cost 3 or greater.
Epicure of Blood,{4}{B},Creature — Vampire,"Whenever you gain life, each opponent loses 1 life."
Erratic Cyclops,{3}{R},Creature — Cyclops Shaman,"Trample Whenever you cast an instant or sorcery spell, Erratic Cyclops gets +X/+0 until end of turn, where X is that spell's converted mana cost."
Erratic Visionary,{1}{U},Creature — Human Wizard,"{1}{U}, {T}: Draw a card, then discard a card."
Erstwhile Trooper,{1}{B}{G},Creature — Zombie Soldier,Discard a creature card: Erstwhile Trooper gets +2/+2 and gains trample until end of turn. Activate this ability only once each turn.
Escape to the Wilds,{3}{R}{G},Sorcery,Exile the top five cards of your library. You may play cards exiled this way until the end of your next turn. You may play an additional land this turn.
Essence Capture,{U}{U},Instant,Counter target creature spell. Put a +1/+1 counter on up to one target creature you control.
Eternal Isolation,{1}{W},Sorcery,Put target creature with power 4 or greater on the bottom of its owner's library.
Eternal Skylord,{4}{U},Creature — Zombie Wizard,"When Eternal Skylord enters the battlefield, amass 2. (Put two +1/+1 counters on an Army you control. If you don't control one, create a 0/0 black Zombie Army creature token first.) Zombie tokens you control have flying."
Eternal Taskmaster,{1}{B},Creature — Zombie,"Eternal Taskmaster enters the battlefield tapped. Whenever Eternal Taskmaster attacks, you may pay {2}{B}. If you do, return target creature card from your graveyard to your hand."
Ethereal Absolution,{4}{W}{B},Enchantment,"Creatures you control get +1/+1. Creatures your opponents control get -1/-1. {2}{W}{B}: Exile target card from an opponent's graveyard. If it was a creature card, you create a 1/1 white and black Spirit creature token with flying."
Ethereal Elk,{3}{G}{G},Creature — Elk Spirit,"Trample When Ethereal Elk enters the battlefield, you may search your library and/or graveyard for a card named Vivien, Nature's Avenger, reveal it, and put it into your hand. If you search your library this way, shuffle it."
"Etrata, the Silencer",{2}{U}{B},Legendary Creature — Vampire Assassin,"Etrata, the Silencer can't be blocked. Whenever Etrata deals combat damage to a player, exile target creature that player controls and put a hit counter on that card. That player loses the game if they own three or more exiled cards with hit counters on them. Etrata's owner shuffles Etrata into their library."
Evolution Sage,{2}{G},Creature — Elf Druid,"Whenever a land enters the battlefield under your control, proliferate. (Choose any number of permanents and/or players, then give each another counter of each kind already there.)"
Evolving Wilds,nan,Land,"{T}, Sacrifice Evolving Wilds: Search your library for a basic land card, put it onto the battlefield tapped, then shuffle your library."
Expansion,{U/R}{U/R},Instant,Copy target instant or sorcery spell with converted mana cost 4 or less. You may choose new targets for the copy.
Experimental Frenzy,{3}{R},Enchantment,You may look at the top card of your library any time. You may play the top card of your library. You can't play cards from your hand. {3}{R}: Destroy Experimental Frenzy.
Explosion,{X}{U}{U}{R}{R},Instant,Explosion deals X damage to any target. Target player draws X cards.
Expose to Daylight,{2}{W},Instant,Destroy target artifact or enchantment. Scry 1.
Eye Collector,{B},Creature — Faerie,"Flying Whenever Eye Collector deals combat damage to a player, each player puts the top card of their library into their graveyard."
Eyes Everywhere,{2}{U},Enchantment,"At the beginning of your upkeep, scry 1. {5}{U}: Exchange control of Eyes Everywhere and target nonland permanent. Activate this ability only any time you could cast a sorcery."
Fabled Passage,nan,Land,"{T}, Sacrifice Fabled Passage: Search your library for a basic land card, put it onto the battlefield tapped, then shuffle your library. Then if you control four or more lands, untap that land."
Fae of Wishes,{1}{U},Creature — Faerie Wizard,"Flying {1}{U}, Discard two cards: Return Fae of Wishes to its owner's hand."
Faeburrow Elder,{1}{G}{W},Creature — Treefolk Druid,"Vigilance Faeburrow Elder gets +1/+1 for each color among permanents you control. {T}: For each color among permanents you control, add one mana of that color."
Faerie Duelist,{1}{U},Creature — Faerie Rogue,"Flash Flying When Faerie Duelist enters the battlefield, target creature an opponent controls gets -2/-0 until end of turn."
Faerie Formation,{4}{U},Creature — Faerie,Flying {3}{U}: Create a 1/1 blue Faerie creature token with flying. Draw a card.
Faerie Guidemother,{W},Creature — Faerie,Flying
Faerie Miscreant,{U},Creature — Faerie Rogue,"Flying When Faerie Miscreant enters the battlefield, if you control another creature named Faerie Miscreant, draw a card."
